{
  "schemaVersion": "nus.question-bank.v1",
  "courseId": "DSA5105",
  "purpose": "Conceptual retrieval and worked reasoning across the DSA5105 learning arc.",
  "blueprint": {
    "questionsPerLesson": 2,
    "sourcePolicy": "Lecture is primary; textbook and reference sources extend or clarify it.",
    "types": ["mcq", "short", "derivation", "calculation"]
  },
  "questions": [
    {
      "id": "dsa5105-bank-001", "lessonId": "dsa5105-erm", "type": "mcq", "difficulty": "easy", "skill": "concept-map", "cognitiveLevel": "understand", "estimatedSeconds": 60,
      "prompt": "A random oracle generates y from p*(·|x). What does one observed pair (x_i, y_i) represent?",
      "choices": ["One draw from the conditional label distribution", "The exact complete oracle", "A validation score", "A regularizer"], "answer": 0,
      "hint": "Separate the data-generating process from one sample.", "explanation": "The pair is one sample drawn at x_i; it does not reveal the full conditional distribution.", "misconception": "Treating an observed label as proof that the oracle is deterministic.", "visualHook": "Trace one x into several possible noisy labels.",
      "sourceRefs": [{"sourceId": "DSA5105/Lec1_annotated.pdf", "page": 20, "sourceType": "lecture", "role": "random oracle", "status": "current"}]
    },
    {
      "id": "dsa5105-bank-002", "lessonId": "dsa5105-erm", "type": "derivation", "difficulty": "medium", "skill": "objective-reading", "cognitiveLevel": "analyze", "estimatedSeconds": 120,
      "prompt": "Write the supervised-learning objective using a hypothesis h, loss l, and training set D.",
      "accepted": ["minimize 1/N sum loss h(x_i),y_i", "argmin h average loss over D", "minimize empirical risk"],
      "solution": "Choose h to minimize R_hat(h) = (1/N) sum_i l(h(x_i), y_i), optionally adding a regularization penalty.", "hint": "Use the average over the N observed pairs.", "explanation": "ERM is an optimization statement over observed data; regularization changes the objective but not the role of the sample average.", "misconception": "Writing a population expectation as if all future data were available.", "visualHook": "Slider from individual losses to their mean empirical risk.",
      "sourceRefs": [{"sourceId": "DSA5105/Lec1_annotated.pdf", "page": 23, "sourceType": "lecture", "role": "ERM objective", "status": "current"}, {"sourceId": "DSA5105/Textbook.pdf", "page": 18, "sourceType": "textbook", "role": "empirical risk", "status": "supporting"}]
    },
    {
      "id": "dsa5105-bank-003", "lessonId": "dsa5105-linear-week1", "type": "short", "difficulty": "easy", "skill": "linear-basis", "cognitiveLevel": "understand", "estimatedSeconds": 75,
      "prompt": "Why can a linear model still represent a nonlinear curve in x?",
      "accepted": ["because it is linear in features or basis functions", "linear in parameters but nonlinear in x", "basis expansion"],
      "solution": "A model can be linear in its parameters while using nonlinear features such as x^2 or sin(x). The feature map carries the nonlinearity.", "hint": "Ask what the word linear refers to.", "explanation": "Linearity in parameters is different from linearity in the original input coordinate.", "misconception": "Assuming every linear model must be a straight line in raw input space.", "visualHook": "Toggle raw x and a polynomial feature map.",
      "sourceRefs": [{"sourceId": "DSA5105/Lec1_annotated.pdf", "page": 31, "sourceType": "lecture", "role": "linear models", "status": "current"}, {"sourceId": "DSA5105/Textbook.pdf", "page": 24, "sourceType": "textbook", "role": "basis functions", "status": "supporting"}]
    },
    {
      "id": "dsa5105-bank-004", "lessonId": "dsa5105-linear-week1", "type": "calculation", "difficulty": "medium", "skill": "ols-uniqueness", "cognitiveLevel": "apply", "estimatedSeconds": 120,
      "prompt": "For X with full column rank, what property makes the least-squares minimizer unique?",
      "accepted": ["X transpose X is invertible", "full column rank", "positive definite X^T X"],
      "solution": "Full column rank makes X^T X positive definite and invertible, giving w_hat = (X^T X)^(-1)X^T y as the unique minimizer.", "hint": "Look at the Hessian of the quadratic objective.", "explanation": "Rank deficiency creates flat directions and multiple minimizers; full rank removes them.", "misconception": "Confusing existence of a minimizer with uniqueness.", "visualHook": "Show a bowl becoming a flat valley as rank is lost.",
      "sourceRefs": [{"sourceId": "DSA5105/Lec1_annotated.pdf", "page": 33, "sourceType": "lecture", "role": "OLS uniqueness", "status": "current"}, {"sourceId": "DSA5105/Textbook.pdf", "page": 25, "sourceType": "textbook", "role": "least squares", "status": "supporting"}]
    },
    {
      "id": "dsa5105-bank-005", "lessonId": "dsa5105-learning-theory", "type": "mcq", "difficulty": "easy", "skill": "generalization", "cognitiveLevel": "understand", "estimatedSeconds": 60,
      "prompt": "Which split should remain untouched until the final model estimate?",
      "choices": ["Test", "Training", "Validation", "Bootstrap sample"], "answer": 0,
      "hint": "Model selection is not final evaluation.", "explanation": "Validation supports choices; the test set estimates performance after those choices are fixed.", "misconception": "Using test performance repeatedly to select hyperparameters.", "visualHook": "Animate information flowing from train to validation to test only once.",
      "sourceRefs": [{"sourceId": "DSA5105/Lec1_annotated.pdf", "page": 17, "sourceType": "lecture", "role": "evaluation split", "status": "current"}, {"sourceId": "DSA5105/Textbook.pdf", "page": 70, "sourceType": "textbook", "role": "generalization", "status": "supporting"}]
    },
    {
      "id": "dsa5105-bank-006", "lessonId": "dsa5105-learning-theory", "type": "short", "difficulty": "medium", "skill": "bias-variance", "cognitiveLevel": "analyze", "estimatedSeconds": 100,
      "prompt": "Explain why a very flexible hypothesis class can still have poor test error.",
      "accepted": ["it can overfit and have high variance", "memorizes training data", "poor generalization"],
      "solution": "A flexible class may fit noise or idiosyncrasies in the sample. Training error falls, but variance and generalization error can rise.", "hint": "Compare fit to observed data with performance on unseen data.", "explanation": "Approximation power is only one of the approximation-optimization-generalization questions.", "misconception": "Believing lower training error always implies lower test error.", "visualHook": "Move a complexity slider and reveal train/test curves.",
      "sourceRefs": [{"sourceId": "DSA5105/Lec1_annotated.pdf", "page": 17, "sourceType": "lecture", "role": "generalization", "status": "current"}, {"sourceId": "DSA5105/Textbook.pdf", "page": 70, "sourceType": "textbook", "role": "overfitting", "status": "supporting"}]
    },
    {
      "id": "dsa5105-bank-007", "lessonId": "dsa5105-linear-regularization", "type": "calculation", "difficulty": "medium", "skill": "regularization", "cognitiveLevel": "apply", "estimatedSeconds": 120,
      "prompt": "In ridge regression, what happens to the objective when lambda increases?",
      "accepted": ["the squared norm penalty receives more weight", "weights are penalized more strongly", "larger regularization penalty"],
      "solution": "The objective adds lambda ||w||^2, so increasing lambda makes large coefficients more costly and usually shrinks the fitted weights.", "hint": "Inspect the coefficient multiplying the norm.", "explanation": "Regularization trades some training fit for a constrained or smoother hypothesis.", "misconception": "Thinking lambda changes the labels rather than the optimization preference.", "visualHook": "Show contours changing from elongated to round as lambda grows.",
      "sourceRefs": [{"sourceId": "DSA5105/Lec1_annotated.pdf", "page": 46, "sourceType": "lecture", "role": "ridge objective", "status": "current"}, {"sourceId": "DSA5105/Textbook.pdf", "page": 29, "sourceType": "textbook", "role": "regularization", "status": "supporting"}]
    },
    {
      "id": "dsa5105-bank-008", "lessonId": "dsa5105-linear-regularization", "type": "derivation", "difficulty": "hard", "skill": "regularized-ols", "cognitiveLevel": "analyze", "estimatedSeconds": 150,
      "prompt": "State the closed-form ridge solution and identify the matrix that is made invertible by lambda > 0.",
      "accepted": ["(X^T X + lambda I)^-1 X^T y", "X transpose X plus lambda I", "ridge solution"],
      "solution": "w_hat_ridge = (X^T X + lambda I)^(-1) X^T y. For lambda > 0, the added positive diagonal term removes zero-eigenvalue directions.", "hint": "Start from the gradient of the squared loss plus lambda||w||^2.", "explanation": "Ridge stabilizes ill-conditioned or rank-deficient least squares.", "misconception": "Adding lambda I to X rather than to the normal-equation matrix.", "visualHook": "Highlight eigenvalues lifted away from zero.",
      "sourceRefs": [{"sourceId": "DSA5105/Lec1_annotated.pdf", "page": 48, "sourceType": "lecture", "role": "ridge solution", "status": "current"}, {"sourceId": "DSA5105/Textbook.pdf", "page": 30, "sourceType": "textbook", "role": "closed form", "status": "supporting"}]
    },
    {
      "id": "dsa5105-bank-009", "lessonId": "dsa5105-svm-margin", "type": "mcq", "difficulty": "easy", "skill": "svm-margin", "cognitiveLevel": "understand", "estimatedSeconds": 60,
      "prompt": "For a hard-margin SVM, which points determine the separating hyperplane?",
      "choices": ["Support vectors on the margin", "All points equally", "Only misclassified points", "The test set"], "answer": 0,